{
  "$schema": "https://json-schema.org/draft/2020-12/schema",
  "$id": "https://apricotpersonallabo.github.io/schemas/product-site-v1.json",
  "title": "Apricot Product Site",
  "type": "object",
  "required": [
    "schemaVersion",
    "product",
    "repository",
    "pages"
  ],
  "properties": {
    "schemaVersion": {
      "const": 1
    },
    "product": {
      "type": "object",
      "required": [
        "name",
        "description"
      ],
      "properties": {
        "name": {
          "type": "string",
          "minLength": 1
        },
        "tagline": {
          "type": "string"
        },
        "description": {
          "type": "string",
          "minLength": 1
        }
      },
      "additionalProperties": true
    },
    "repository": {
      "type": "object",
      "required": [
        "url"
      ],
      "properties": {
        "url": {
          "type": "string",
          "format": "uri"
        },
        "issues": {
          "type": "string",
          "format": "uri"
        }
      },
      "additionalProperties": true
    },
    "theme": {
      "type": "object",
      "properties": {
        "primary": {
          "type": "string",
          "pattern": "^#[0-9a-fA-F]{6}$"
        },
        "accent": {
          "type": "string",
          "pattern": "^#[0-9a-fA-F]{6}$"
        }
      },
      "additionalProperties": true
    },
    "languages": {
      "type": "array",
      "items": {
        "type": "string",
        "pattern": "^[a-z]{2,3}(-[A-Za-z0-9]{2,8})*$"
      },
      "minItems": 1,
      "uniqueItems": true
    },
    "pages": {
      "type": "array",
      "minItems": 1,
      "items": {
        "type": "object",
        "required": [
          "slug",
          "title",
          "source"
        ],
        "properties": {
          "slug": {
            "type": "string",
            "pattern": "^[a-z0-9-]+$"
          },
          "title": {
            "type": "string",
            "minLength": 1
          },
          "source": {
            "type": "string",
            "minLength": 1
          },
          "locales": {
            "type": "object",
            "additionalProperties": {
              "type": "object",
              "required": [
                "title",
                "source"
              ],
              "properties": {
                "title": {
                  "type": "string",
                  "minLength": 1
                },
                "source": {
                  "type": "string",
                  "minLength": 1
                }
              },
              "additionalProperties": false
            }
          }
        },
        "additionalProperties": true
      }
    },
    "defaultLanguage": {
      "type": "string",
      "pattern": "^[a-z]{2,3}(-[A-Za-z0-9]{2,8})*$"
    },
    "favicon": {
      "type": "string",
      "pattern": "^[A-Za-z0-9][A-Za-z0-9/_.-]*$"
    }
  },
  "additionalProperties": true
}
